pubDate,title
02/01/2025,Why Apple (AAPL) Shares Are Sliding Today
03/01/2025,Apple (AAPL) Stock Falls Amid Market Uptick: What Investors Need to Know
12/01/2025,Why We're Not Concerned About Apple Inc.'s (NASDAQ:AAPL) Share Price
13/01/2025,Is Apple Inc. (AAPL) the Best NASDAQ Stock to Buy in 2025?
14/01/2025,Apple Inc. (AAPL)’s Struggle: Can AI Help Regain Market Share in 2025?
14/01/2025,KeyBanc Expects Apple (AAPL) to Report Soft Guidance and Keeps Sell Rating
14/01/2025,Is Apple Inc. (AAPL) the Best Safe Dividend Stock for 2025?
15/01/2025,Apple (NASDAQ:AAPL) Seems To Use Debt Rather Sparingly
16/01/2025,Is Apple Inc. (AAPL) the Best NASDAQ Dividend Stock to Buy?
16/01/2025,Apple Stock Falls 11%—Can AAPL Hold This Critical Support Level?
17/01/2025,Apple (NASDAQ:AAPL) Stock Plunges on Weak Sales and AI Challenges
18/01/2025,Why Is Cliff Asness Bullish On Apple Inc. (AAPL)?
19/01/2025,"Jim Cramer on Apple Inc. (AAPL): ‘I Think When You Say Stuff Like Nothing’s Been Done Since Steve Jobs Died, I Think That’s An Ill-advised Strategy To Take I Think’"
19/01/2025,"With 61% ownership of the shares, Apple Inc. (NASDAQ:AAPL) is heavily dominated by institutional owners"
20/01/2025,Jim Cramer on Apple Inc. (AAPL): ‘Apple Wildcard To The Downside. It’s Kind Of A Two Of Clubs’
21/01/2025,Did Billionaire Chen Tianqiao Dump or Bet on Apple Inc. (AAPL)?
22/01/2025,"Jefferies Downgrades Apple Inc. (AAPL) to Underperform, Citing Weak Revenue Outlook and Subdued AI Focus"
23/01/2025,Greenlight Capital’s Updates on Apple (AAPL)
24/01/2025,Is Apple (AAPL) Among the Stocks ChatGPT Predicts Could Make You Wealthy in 10 Years?
25/01/2025,Is Apple Inc. (AAPL) The Best Bear Market Stock To Invest In Now?
27/01/2025,Apple Inc. (AAPL): Expanding AI Investments Propel Ecosystem Growth and Innovation
27/01/2025,Apple bucks DeepSeek sell-off as investors await Q1 results (NASDAQ:AAPL)
27/01/2025,Reasons To Hold Apple Stock As Q1 Earnings Approach (NASDAQ:AAPL)
27/01/2025,Apple Stock (AAPL) Rallies while AI Stocks Tumble
27/01/2025,Apple Inc. (AAPL): Strengthening AI Leadership with Apple Intelligence
28/01/2025,"Rosenblatt Securities Reaffirms Buy Rating on Apple Inc. (AAPL), Highlights Challenges from Chinese Rivals and Low iPhone Expectations"
28/01/2025,Apple Inc. (AAPL): Jim Cramer Explains Why It’s the ‘Quarterback of Your Portfolio’
28/01/2025,"Apple Inc. (AAPL): TD Cowen Reiterates $250 Price Target, Sees AI Advancements Driving Growth and Innovation"
29/01/2025,Jim Cramer on Apple Inc. (AAPL): ‘We Have The Most Widely Anticipated Disappointment That I’ve Ever Seen’
29/01/2025,"Apple Inc. (AAPL) Reports 6% Revenue Growth in Q4 2024, Driven by New Product Launches and AI Integration"
29/01/2025,Apple (AAPL) Gets Downgraded on Reduced iPhone Sales Estimates
29/01/2025,Why Are Hedge Funds Bullish on Apple Inc. (AAPL)?
29/01/2025,Is Apple Inc. (AAPL) the Best Consumer Electronics Stock to Invest in Now?
30/01/2025,Jim Cramer on Apple (AAPL) Shares Underperforming Recently: ‘Everyone Was Shorting It Ahead Of The Quarter’
30/01/2025,Apple (AAPL) Surpasses Q1 Earnings and Revenue Estimates
30/01/2025,Dan Niles: Apple (AAPL) Bulls ‘Trying to Pretend’ an Upgrade Cycle is Coming
30/01/2025,"After Hours Most Active for Jan 30, 2025 : NVDA, INTC, AAPL, BHC, OKE, LUMN, NEP, CIFR, AMZN, BORR, QQQ, RBLX"
30/01/2025,Apple Stock: It's Still A Sell (NASDAQ:AAPL)
30/01/2025,"Jim Cramer on Apple Inc. (AAPL): ‘I Said It’s Gonna Come Down, I Said It’s A Weak Quarter’"
30/01/2025,Why Apple (AAPL) Is the Best Stock to Buy in 2025 for Beginners
30/01/2025,Apple shares rise 3% as boost in services revenue overshadows iPhone miss
30/01/2025,AAPL Earnings: Apple Beats EPS Estimates but Continues to Lag in China
30/01/2025,Apple (NASDAQ:AAPL) Reports Q4 In Line With Expectations
30/01/2025,"4 stocks to watch on Thursday: AAL, AAPL and more (SP500:S&P Complete Indices)"
30/01/2025,"Stocks making the biggest moves after hours: Apple, Intel, Atlassian, Deckers, Walgreens and more"
31/01/2025,Wall Street Scrambles to Upgrade Apple (NASDAQ:AAPL) Price Targets on Earnings and AI
31/01/2025,Is Apple Inc. (AAPL) Among Warren Buffett’s Longest-Held Stocks?
31/01/2025,Needham Reiterates Buy Rating on Apple (AAPL)
31/01/2025,Apple Inc (AAPL) Q1 2025 Earnings Call Highlights: Record Revenue and EPS Amidst Global Challenges
31/01/2025,Apple Inc. (AAPL): Integrating AI in Devices for Personal Privacy
31/01/2025,Apple (AAPL) Stock Climbs as AI Strategy Fuels Growth Hopes
02/02/2025,Apple’s AI and AR Struggles Show It Has Lost Some of Its Product Edge
02/02/2025,Jim Cramer on Apple (AAPL)’s New Phone: ‘It’ll Be Too Fabulous’
03/02/2025,"Monness Reiterates Buy on Apple Inc. (AAPL), Citing AI Potential and Ecosystem Strength"
03/02/2025,Apple Inc. (AAPL) is Attracting Investor Attention: Here is What You Should Know
03/02/2025,"Analyst Upgraded AAPL Target, Sees Minimal Tariff Impact on Earnings"
03/02/2025,Jim Cramer on Apple Inc (AAPL): ‘The Watch Is Crushing It’
03/02/2025,Why AAPL Is Sliding Today
04/02/2025,"BofA Reiterates ‘Buy’ on Apple Inc. (AAPL), Citing AI Growth and Resilient Supply Chain Amid Tariffs"
04/02/2025,Apple (AAPL) stock price forecast: third-party price target
04/02/2025,JPMorgan Reiterates Overweight Rating on Apple (AAPL)
05/02/2025,China Weighs Taking Bite of Apple’s (NASDAQ:AAPL) App Store Fees
05/02/2025,"Stocks making the biggest moves midday: Alphabet, Apple, Uber, Nvidia and more"
05/02/2025,"Jim Cramer on Apple (AAPL): ""Why Don’t People Own Apple Here?"""
06/02/2025,"Apple Inc. (AAPL) – Positioned for the AI Boom, But Is It Enough?"
06/02/2025,Apple Inc. (AAPL) Launches ‘Apple Invites’ App with AI-Driven Event Planning and Custom Invitations
06/02/2025,Apple’s Long-Awaited Overhaul of iPhone SE Nears Release
06/02/2025,SWKS Stock Plummets 23% as Apple (AAPL) Reduces Its Content Reliance for iPhone 17
07/02/2025,UK Ask for Backdoor to Apple (AAPL) Users’ Data Alarms Privacy Experts
07/02/2025,Apple likely to unveil new iPhone SE in coming days: report (AAPL)
08/02/2025,Is Apple Inc. (AAPL) the Best Stock to Invest In for Grandchildren?
08/02/2025,Apple Inc. (AAPL) Begins Mass Production of AI-Optimized M5 Chip for Next-Gen Devices
08/02/2025,Experts Predict How High Apple Stock Could Go in 2025
09/02/2025,"Apple Is Not Overvalued, Buy And Hold (NASDAQ:AAPL)"
09/02/2025,Apple (AAPL): ‘How Could It Be a Surprise?’ Jim Cramer Questions the Bearish Narrative
09/02/2025,Apple: Weak Growth At An Unreasonable Price (NASDAQ:AAPL)
10/02/2025,"After Hours Most Active for Feb 10, 2025 : INTC, PINS, NVDA, MSFT, PFE, WBD, IP, PLTR, AAPL, ALTM, FCX, SNAP"
10/02/2025,Apple Stock: Forget Q1 Results
10/02/2025,Dan Niles Says Apple (AAPL) Has ‘No AI Presence’
11/02/2025,Apple (AAPL) and Alibaba (BABA) Shares Rise on Reports of Chinese AI iPhone Partnership
11/02/2025,Apple Stock: A Smarter AI Play Than Nvidia?
11/02/2025,iOS 18.3.1 Released With Critical Security Fix: Apple Confirms USB Restricted Mode Vulnerability Was Actively Exploited
11/02/2025,Jim Cramer Says China Was Considering An Investigation Against Apple Inc (AAPL)’s App Store Platform
11/02/2025,Apple (AAPL) and Alibaba (BABA) Join Forces to Bring AI to iPhones in China
11/02/2025,Apple Reportedly Picks Alibaba As China AI Partner
11/02/2025,"Adios Gulf of Mexico as Google, Apple maps rename to Gulf of America (AAPL:NASDAQ)"
11/02/2025,BofA Securities Reiterates Buy Rating on Apple (AAPL)
11/02/2025,Why Apple (AAPL) Stock Is Trading Up Today
11/02/2025,"PLTR, MSFT and AAPL Forecast – Major US Tech Stocks Somewhat Mixed in Premarket"
11/02/2025,"Apple, Alibaba to bring AI to iPhones in China: report (AAPL:NASDAQ)"
11/02/2025,Why AAPL Is Advancing Today
11/02/2025,"Live Markets: S&P Flips Green, KO, AAPL, INTC Rise"
11/02/2025,Morgan Stanley Keeps Its Apple (AAPL) Buy Rating amid Optimistic iPhone SE 4 Outlook
11/02/2025,Steve Jobs Delivered Powerful Life Message In His Most Memorable Speech: 'Your Time is Limited So Don't Waste It Living Someone Else's Life'
11/02/2025,(AAPL) Trading Advice
11/02/2025,"Under the Radar: Uncovering Profitable, Undervalued Stocks"
11/02/2025,10 Information Technology Stocks Whale Activity In Today's Session
11/02/2025,Best Stock to Buy Right Now: Nike vs. Apple
11/02/2025,Should You Buy or Sell AAPL Stock? Here’s How High Apple Can Go This Year
11/02/2025,Apple Inc. (AAPL): Among the Best Dividend Stocks to Invest In Now According to Warren Buffett
12/02/2025,Apple (AAPL) Stock: Recent News and Rating Change
12/02/2025,Apple (AAPL) Robotics Vision Takes Shape-Here's What We Know So Far
13/02/2025,Apple Inc. (AAPL): Among Lee Munder Capital Group’s Top Stock Picks
13/02/2025,Apple (AAPL) Shares Rise Ahead of “New Family Member” Next Week
15/02/2025,Apple Inc. (AAPL): Among the Best Forever Stocks to Buy Right Now
17/02/2025,Apple Inc. (AAPL): Among the Best Streaming Service Stocks to Buy According to Analysts
18/02/2025,Apple (AAPL) Gains Analyst Confidence with Upcoming Product Launches
18/02/2025,Apple Stock Price in 5 Years: AAPL Shares Have Further Room To Grow
18/02/2025,Is Apple Inc. (AAPL) the Most Profitable Tech Stock to Buy Now?
18/02/2025,Apple Inc. (AAPL) Teases New Product Launch with AI and In-House Modem
20/02/2025,Is Apple Stock A Buy After iPhone 16e Debut?
23/02/2025,Is Apple Inc. (AAPL) the Top Stock to Buy According to Sustainable Insight Capital Management?
25/02/2025,Is Apple Inc. (AAPL) Buying Back Its Stock in 2025?
26/02/2025,"AAPL, NVDA, TSLA: Magnificent 7 Stocks Fall into Correction Territory"
26/02/2025,Apple Inc. (AAPL): Among the Best Fortune 500 Stocks to Buy According to Hedge Funds
28/02/2025,Apple Inc. (AAPL) Maintained at ‘Buy’ as iPhone 16e and AI Investments Boost Optimism
28/02/2025,Jim Cramer on Apple Inc. (AAPL): ‘It’s Very Hard To Own Apple Here Now Because You Do Not Know If The President Is Going To Attach Tariffs To Taiwan’
01/03/2025,Is Apple Inc. (AAPL) The Best Money Making Stock To Buy Now?
01/03/2025,Apple Inc. (AAPL): Among Best Stocks To Invest In From Couch Potato Stock Portfolio
04/03/2025,"Apple (AAPL) Makes an Interesting Gamble on the iPhone 16e, and It's All About China"
04/03/2025,Apple (AAPL): Analysts Warn Two Things Threaten Stock in 2025
04/03/2025,Jefferies Analysts Warn of Weaker iPhone 16e Demand: Is Apple (AAPL) Facing Growth Challenges in China?
04/03/2025,"Apple (AAPL) Is the Best Technology Stock to Own in a Trade War, Says Evercore ISI"
04/03/2025,Wedbush Sticks to Buy Rating on Apple (AAPL) Stock as Alibaba Deal Unlocks AI Growth
04/03/2025,"iPad Air, iPad Get Upgrades at Apple (NASDAQ:AAPL)"
05/03/2025,Qualcomm (QCOM) Launches X85 Modem to Outperform Apple's (AAPL) Chips
05/03/2025,Apple (AAPL) Launches Cheaper MacBook Air
05/03/2025,"Apple Debuts New MacBook Air, Mac Studio With AI-Ready Chips"
05/03/2025,Apple (NasdaqGS:AAPL) Unveils Faster iPad Air With M3 Chip Starting At US$599
05/03/2025,Apple Inc. (AAPL): Among the Best Stocks To Invest In According to Billionaires
05/03/2025,Apple (AAPL) introduces the new MacBook Air
05/03/2025,Apple (AAPL) unveils new Mac Studio
05/03/2025,Apple (AAPL): Alibaba Partnership Sparks Optimism for Chinese Market Growth
05/03/2025,"AAPL, NVDA, or PLTR: Which Tech Stock Is the Most Attractive Pick?"
06/03/2025,BofA Reiterates ‘Buy’ on Apple Inc. (AAPL) as App Store Revenue Surges
06/03/2025,Apple (AAPL) Introduces M3-Powered iPad Air
06/03/2025,Apple Is Down for the Year—Opportunity or Time to Move On?
06/03/2025,"A Foldable iPhone from Apple (AAPL) Is Coming, Predicts Analyst"
06/03/2025,"Apple likely to launch first foldable iPhone in 2026, could cost over $2,000: analyst (AAPL:NASDAQ)"
06/03/2025,April 25th Options Now Available For Apple (AAPL)
07/03/2025,Apple Inc. (NASDAQ:AAPL) Shares Sold by City Holding Co.
07/03/2025,"Live Nasdaq Composite: Stocks Lack Conviction, NVDA, AAPL and AVGO Rise"
07/03/2025,"My Legacy Advisors LLC Buys 1,402 Shares of Apple Inc. (NASDAQ:AAPL)"
07/03/2025,"Live Nasdaq Composite: Stocks Lack Conviction, NVDA, AAPL and AVGO Rise"
07/03/2025,Will Trump Tariffs Take Apple Stock To $160?
07/03/2025,"Notable Friday Option Activity: AAPL, AMZN, MSFT"
07/03/2025,Apple says more personalized version of Siri is delayed (AAPL:NASDAQ)
07/03/2025,Apple (AAPL) Beats Stock Market Upswing: What Investors Need to Know
07/03/2025,"Apple: Dog Collar Working As Planned, Just In Time (NASDAQ:AAPL)"
07/03/2025,Is Apple Inc. (AAPL) Among the Best Warren Buffett Stock to Buy Right Now?
07/03/2025,Apple Inc. (AAPL): Jim Cramer Cautions – ‘I Could See the Stock Going Lower!’
07/03/2025,Apple (AAPL) Clears Hurdle to Sell iPhone 16 in Indonesia
07/03/2025,Apple Inc. (AAPL) DCF Valuation: Is The Stock Undervalued?
08/03/2025,Could Apple Be a Millionaire-Maker Stock?
08/03/2025,Apple: The iPhone Lesson I’ve Learned (NASDAQ:AAPL)
08/03/2025,Apple Inc. (AAPL) Unveils Most Powerful Mac Studio with M4 Max & M3 Ultra
08/03/2025,"Apple (AAPL) Eyes 2026 Launch for $2000+ Foldable, AI-Driven iPhone"
08/03/2025,Apple Inc. (AAPL) Unveils AI-Powered MacBook Air with M4 Chip
08/03/2025,"Diversify Wealth Management LLC Purchases 37,036 Shares of Apple Inc. (NASDAQ:AAPL)"
09/03/2025,Cove Private Wealth LLC Increases Holdings in Apple Inc. (NASDAQ:AAPL)
09/03/2025,AMI Investment Management Inc. Sells 53 Shares of Apple Inc. (NASDAQ:AAPL)
09/03/2025,Apple Inc. (NASDAQ:AAPL) Shares Acquired by Uncommon Cents Investing LLC
09/03/2025,Apple Breaks Tradition With A Flood Of New Releases; Explores Smart Glasses
09/03/2025,Lionsbridge Wealth Management LLC Trims Stake in Apple Inc. (NASDAQ:AAPL)
09/03/2025,Analyst: Apple Inc (AAPL) May Have to Pass On Tariff Impact to Consumers
09/03/2025,Apple Inc. (NASDAQ:AAPL) is Overbrook Management Corp’s 10th Largest Position
09/03/2025,Apple Stock To Fall 30%?
09/03/2025,"Maltin Wealth Management Inc. Buys 1,365 Shares of Apple Inc. (NASDAQ:AAPL)"
09/03/2025,Apple Inc. (NASDAQ:AAPL) Shares Purchased by Flower City Capital
09/03/2025,Amplius Wealth Advisors LLC Purchases 600 Shares of Apple Inc. (NASDAQ:AAPL)
09/03/2025,Apple Inc. (NASDAQ:AAPL) is Bridgewater Advisors Inc.’s 6th Largest Position
09/03/2025,Apple Inc. (NASDAQ:AAPL) Position Trimmed by FLC Capital Advisors
09/03/2025,Corundum Group Inc. Has $6.97 Million Position in Apple Inc. (NASDAQ:AAPL)
09/03/2025,Union Savings Bank Sells 649 Shares of Apple Inc. (NASDAQ:AAPL)
09/03/2025,McCarthy & Cox Cuts Stake in Apple Inc. (NASDAQ:AAPL)
09/03/2025,Gemmer Asset Management LLC Sells 820 Shares of Apple Inc. (NASDAQ:AAPL)
09/03/2025,Apple Inc. (NASDAQ:AAPL) is MassMutual Private Wealth & Trust FSB’s Largest Position
09/03/2025,"Apple's Tumultuous Week – From Siri Delays, Legal Battles, And New Product Teasers: This Week In Appleverse"
09/03/2025,Apple Inc. (NASDAQ:AAPL) Stock Position Cut by Zhang Financial LLC
09/03/2025,Ervin Investment Management LLC Cuts Position in Apple Inc. (NASDAQ:AAPL)
09/03/2025,Penn Davis Mcfarland Inc. Purchases 621 Shares of Apple Inc. (NASDAQ:AAPL)
09/03/2025,Apple Inc. (NASDAQ:AAPL) Stake Lessened by Guinness Atkinson Asset Management Inc
10/03/2025,Central Bank & Trust Co. Has $21.91 Million Stock Holdings in Apple Inc. (NASDAQ:AAPL)
10/03/2025,Mountain Pacific Investment Advisers LLC Has $5.80 Million Stock Position in Apple Inc. (NASDAQ:AAPL)
10/03/2025,Leonard Rickey Investment Advisors P.L.L.C. Sells 283 Shares of Apple Inc. (NASDAQ:AAPL)
10/03/2025,Addenda Capital Inc. Has $37.70 Million Position in Apple Inc. (NASDAQ:AAPL)
10/03/2025,Apple Inc. (NASDAQ:AAPL) Shares Sold by Koshinski Asset Management Inc.
10/03/2025,Abacus Wealth Partners LLC Decreases Holdings in Apple Inc. (NASDAQ:AAPL)
10/03/2025,Apple Inc. (NASDAQ:AAPL) Shares Sold by Sky Investment Group LLC
10/03/2025,"Hoese & Co LLP Acquires 2,160 Shares of Apple Inc. (NASDAQ:AAPL)"
10/03/2025,Apple Inc. (NASDAQ:AAPL) Shares Sold by Wealthquest Corp
10/03/2025,Apple Inc. (NASDAQ:AAPL) Shares Purchased by Pure Financial Advisors LLC
10/03/2025,CMH Wealth Management LLC Acquires 935 Shares of Apple Inc. (NASDAQ:AAPL)
10/03/2025,Apple Inc. (NASDAQ:AAPL) Holdings Lowered by Sowa Financial Group Inc.
10/03/2025,Priebe Wealth Holdings LLC Raises Stock Position in Apple Inc. (NASDAQ:AAPL)
10/03/2025,Apple Inc. (NASDAQ:AAPL) is Regent Peak Wealth Advisors LLC’s 3rd Largest Position
10/03/2025,Apple Inc. (NASDAQ:AAPL) Shares Sold by Reliant Investment Management LLC
10/03/2025,Apple Inc. (NASDAQ:AAPL) is Culbertson A N & Co. Inc.’s 2nd Largest Position
10/03/2025,Apple’s (AAPL) AI Struggles Deepen as Siri Upgrade Delayed Until 2026
